"Tweet id","Tweet permalink","Tweet text","time","impressions","engagements","engagement rate","retweets","replies","likes","user profile clicks","url clicks","hashtag clicks","detail expands","permalink clicks","app opens","app installs","follows","email tweet","dial phone","media views","media engagements","promoted impressions","promoted engagements","promoted engagement rate","promoted retweets","promoted replies","promoted likes","promoted user profile clicks","promoted url clicks","promoted hashtag clicks","promoted detail expands","promoted permalink clicks","promoted app opens","promoted app installs","promoted follows","promoted email tweet","promoted dial phone","promoted media views","promoted media engagements"
"1398008337128595456","https://twitter.com/seamlessbayarea/status/1398008337128595456","Interested in the latest  polling showing that seamlessness is overwhelmingly popular? Dial in here: https://t.co/wHpyc5UKbw https://t.co/yvMjKo6CNx","2021-05-27 20:08 +0000","896.0","24.0","0.026785714285714284","2.0","0.0","4.0","0.0","6.0","0.0","6.0","0.0","0","0","0","0","0","6","6","-","-","-","-","-","-","-","-","-","-","-","-","-","-","-","-","-","-"
"1397974112312696833","https://twitter.com/seamlessbayarea/status/1397974112312696833","""An overwhelming majority of polled Bay Area respondents favor state legislation from Assemblymember David Chiu proposing a consolidated regional public transit system... Overall, 89% of respondents supported the bill."" 🚍🚆🚏https://t.co/j9QLeAsEgP","2021-05-27 17:52 +0000","645.0","13.0","0.020155038759689922","1.0","0.0","5.0","2.0","4.0","0.0","1.0","0.0","0","0","0","0","0","0","0","-","-","-","-","-","-","-","-","-","-","-","-","-","-","-","-","-","-"
"1397944961539010561","https://twitter.com/seamlessbayarea/status/1397944961539010561","Last night, the AC Transit board voted unanimously for a 6-month pilot for hybrid meetings while looking for better technology to make virtual access permanent. Thank you @rideact! 👏 https://t.co/292lbgMfeQ","2021-05-27 15:57 +0000","2047.0","33.0","0.01612115290669272","4.0","0.0","16.0","0.0","0.0","0.0","13.0","0.0","0","0","0","0","0","0","0","-","-","-","-","-","-","-","-","-","-","-","-","-","-","-","-","-","-"
"1397682031333572608","https://twitter.com/seamlessbayarea/status/1397682031333572608","Happening TONIGHT at 5 p.m. PT. 

See you there! https://t.co/GWRG8FBgpl","2021-05-26 22:32 +0000","828.0","1.0","0.0012077294685990338","0.0","0.0","1.0","0.0","0.0","0.0","0.0","0.0","0","0","0","0","0","0","0","-","-","-","-","-","-","-","-","-","-","-","-","-","-","-","-","-","-"
"1397665517842821121","https://twitter.com/seamlessbayarea/status/1397665517842821121","We are proud to work alongside agencies, drivers, and riders across our region today and every day. We are devastated by this violence and offer our deepest sympathy to the victims and their families, friends, and coworkers. (2/2)","2021-05-26 21:26 +0000","883.0","12.0","0.013590033975084938","1.0","0.0","9.0","0.0","0.0","0.0","2.0","0.0","0","0","0","0","0","0","0","-","-","-","-","-","-","-","-","-","-","-","-","-","-","-","-","-","-"
"1397665516911616000","https://twitter.com/seamlessbayarea/status/1397665516911616000","On behalf of the board at Seamless Bay Area, we extend our condolences to the @VTA family and our friends and colleagues in Santa Clara County following this morning's tragedy. (1/2)","2021-05-26 21:26 +0000","2976.0","64.0","0.021505376344086023","4.0","1.0","20.0","6.0","0.0","0.0","33.0","0.0","0","0","0","0","0","0","0","-","-","-","-","-","-","-","-","-","-","-","-","-","-","-","-","-","-"
"1397615828720254977","https://twitter.com/seamlessbayarea/status/1397615828720254977","@SeanHedgpeth @tpap_ @WarrenMobility Doing these as multi-agency one-off arrangements is fragile, and we need more stable systems to provide people access to affordable mobility to where they need to go","2021-05-26 18:09 +0000","28.0","1.0","0.03571428571428571","0.0","0.0","1.0","0.0","0.0","0.0","0.0","0.0","0","0","0","0","0","0","0","-","-","-","-","-","-","-","-","-","-","-","-","-","-","-","-","-","-"
"1397598961402216448","https://twitter.com/seamlessbayarea/status/1397598961402216448","@SeanHedgpeth @tpap_ @WarrenMobility This was discontinued, if I recall correctly for reasons technical and financial. This is an example of why we need more stable structures to provide continuity for integrated fares and transit service coordination.","2021-05-26 17:02 +0000","101.0","4.0","0.039603960396039604","0.0","2.0","0.0","0.0","0.0","0.0","2.0","0.0","0","0","0","0","0","0","0","-","-","-","-","-","-","-","-","-","-","-","-","-","-","-","-","-","-"
"1397386182170845191","https://twitter.com/seamlessbayarea/status/1397386182170845191","@RebeccaForBART Thank you! BART's confirming this provides positive peer pressure for other agencies to keep remote public comment and enable people who have responsibilities to children,  jobs etc, who want to participate and contribute, but can't travel and sit for hours in a board room.","2021-05-26 02:56 +0000","414.0","9.0","0.021739130434782608","1.0","0.0","4.0","1.0","0.0","0.0","3.0","0.0","0","0","0","0","0","0","0","-","-","-","-","-","-","-","-","-","-","-","-","-","-","-","-","-","-"
"1397350347543248896","https://twitter.com/seamlessbayarea/status/1397350347543248896","👏👏👏 https://t.co/alhUasl0MD","2021-05-26 00:34 +0000","2301.0","22.0","0.009561060408518035","3.0","1.0","10.0","2.0","0.0","0.0","6.0","0.0","0","0","0","0","0","0","0","-","-","-","-","-","-","-","-","-","-","-","-","-","-","-","-","-","-"
"1397343930354597889","https://twitter.com/seamlessbayarea/status/1397343930354597889","This is also an important moment to raise this topic with other Bay Area transit agency boards as they plan for the future. There are several opportunities over the next week. 

Full list of upcoming meetings on our blog - add them to your calendars 🗓️ https://t.co/1ClqS2sfIm","2021-05-26 00:08 +0000","723.0","12.0","0.016597510373443983","0.0","1.0","1.0","0.0","5.0","0.0","5.0","0.0","0","0","0","0","0","0","0","-","-","-","-","-","-","-","-","-","-","-","-","-","-","-","-","-","-"
"1397343929293361156","https://twitter.com/seamlessbayarea/status/1397343929293361156","Tomorrow, May 26, the @rideact board is discussing whether to proceed with hybrid meetings this summer.  

AC Transit users, this is an important moment to share your support for continued online and dial-in/Zoom public comment. See agenda item 7.J. https://t.co/ViE1cCoDL5","2021-05-26 00:08 +0000","5062.0","25.0","0.004938759383642829","3.0","2.0","2.0","1.0","3.0","0.0","14.0","0.0","0","0","0","0","0","0","0","-","-","-","-","-","-","-","-","-","-","-","-","-","-","-","-","-","-"
"1397343928307785729","https://twitter.com/seamlessbayarea/status/1397343928307785729","Transit riders and advocates must speak up NOW in support of continued online and dial-in public comment at public meetings.","2021-05-26 00:08 +0000","309.0","2.0","0.006472491909385114","0.0","1.0","1.0","0.0","0.0","0.0","0.0","0.0","0","0","0","0","0","0","0","-","-","-","-","-","-","-","-","-","-","-","-","-","-","-","-","-","-"
"1397343927296921602","https://twitter.com/seamlessbayarea/status/1397343927296921602","Without attention and advocacy now, Californians across the state may lose virtual access to public meetings when the pandemic ends. 

This will make public advocacy for more seamless and frequent transit - and many other areas of interest to our region - much more difficult.","2021-05-26 00:08 +0000","275.0","2.0","0.007272727272727273","0.0","1.0","1.0","0.0","0.0","0.0","0.0","0.0","0","0","0","0","0","0","0","-","-","-","-","-","-","-","-","-","-","-","-","-","-","-","-","-","-"
"1397343926277742594","https://twitter.com/seamlessbayarea/status/1397343926277742594","The ability to provide public comment by phone or Zoom was enabled by executive orders issued by Gov. Gavin Newsom in March 2020 that are scheduled to sunset once CA is no longer in a state of emergency.","2021-05-26 00:08 +0000","231.0","4.0","0.017316017316017316","0.0","1.0","1.0","0.0","0.0","0.0","2.0","0.0","0","0","0","0","0","0","0","-","-","-","-","-","-","-","-","-","-","-","-","-","-","-","-","-","-"
"1397343925128482820","https://twitter.com/seamlessbayarea/status/1397343925128482820","🚨 Virtual meetings during the pandemic have turbocharged transit advocacy in the Bay Area and beyond, enabling many more riders &amp; advocates to speak out for worker protections, service restoration, &amp; more. But all that could be coming to an end. 🚨https://t.co/1ClqS2sfIm","2021-05-26 00:08 +0000","5516.0","61.0","0.011058738216098622","9.0","1.0","5.0","7.0","6.0","0.0","33.0","0.0","0","0","0","0","0","0","0","-","-","-","-","-","-","-","-","-","-","-","-","-","-","-","-","-","-"
"1397256738995245057","https://twitter.com/seamlessbayarea/status/1397256738995245057","We're looking forward to tomorrow's @SPUR_Urbanist
forum on the future of California transportation policy. Proud to co-host with Friends of Caltrain, the @BayAreaCouncil, &amp; @SVLeadershipGrp at 5pm PT! 

RSVP here: https://t.co/f5IEwdFq7Y","2021-05-25 18:22 +0000","3467.0","30.0","0.008653014133256417","6.0","0.0","5.0","4.0","6.0","0.0","9.0","0.0","0","0","0","0","0","0","0","-","-","-","-","-","-","-","-","-","-","-","-","-","-","-","-","-","-"
"1397255225849745410","https://twitter.com/seamlessbayarea/status/1397255225849745410","Though @AsmMarcBerman's VTA reform bill, AB 1091, was tabled earlier this month, it is worth discussing the potential benefits of restructuring the VTA board, as well as opportunities for future reform.

New analysis on our blog ⤵️ https://t.co/CVfdpbctsY","2021-05-25 18:16 +0000","801.0","17.0","0.02122347066167291","1.0","0.0","2.0","0.0","9.0","0.0","5.0","0.0","0","0","0","0","0","0","0","-","-","-","-","-","-","-","-","-","-","-","-","-","-","-","-","-","-"
"1396956750352326659","https://twitter.com/seamlessbayarea/status/1396956750352326659","On Thur  1pm there will be a special presentation to dive into polling details showing thatseamless transit is one of the most popular results they've ever seen - watch if you can make it https://t.co/wHpyc5UKbw
Phone: (408) 638-0968 
Meeting ID: 851 9024 0716
Passcode: 787158","2021-05-24 22:30 +0000","883.0","5.0","0.0056625141562853904","0.0","0.0","0.0","0.0","3.0","0.0","2.0","0.0","0","0","0","0","0","0","0","-","-","-","-","-","-","-","-","-","-","-","-","-","-","-","-","-","-"
"1396955718226350087","https://twitter.com/seamlessbayarea/status/1396955718226350087","not only is seamlessness overwhelmingly popular, the poll showed that respondents do not find common objections credible https://t.co/pSED0dYvEF","2021-05-24 22:26 +0000","1255.0","48.0","0.03824701195219123","0.0","2.0","8.0","2.0","1.0","0.0","10.0","0.0","0","0","0","0","0","25","25","-","-","-","-","-","-","-","-","-","-","-","-","-","-","-","-","-","-"
"1396923520823619584","https://twitter.com/seamlessbayarea/status/1396923520823619584","NOW: Bay Area Blue Ribbon Transit Recovery Task Force meeting just started. Task force members will be discussing this poll and much more. 

Join here: https://t.co/V66jk4rccT https://t.co/EAKVmN8oko","2021-05-24 20:18 +0000","989.0","9.0","0.00910010111223458","0.0","0.0","0.0","1.0","2.0","0.0","6.0","0.0","0","0","0","0","0","0","0","-","-","-","-","-","-","-","-","-","-","-","-","-","-","-","-","-","-"
"1396893412943556609","https://twitter.com/seamlessbayarea/status/1396893412943556609","This meeting will be an important opportunity to learn about San Jose's plans for parking and transportation demand management ⤵️

Email Advocacy@CatalyzeSV.org for meeting details &amp; Zoom info! @CatalyzeSV https://t.co/Mhgb5k7vMh","2021-05-24 18:18 +0000","1182.0","4.0","0.00338409475465313","0.0","0.0","2.0","0.0","0.0","0.0","2.0","0.0","0","0","0","0","0","0","0","-","-","-","-","-","-","-","-","-","-","-","-","-","-","-","-","-","-"
"1396616923484352519","https://twitter.com/seamlessbayarea/status/1396616923484352519","This poll will be presented at Monday's 1pm meeting of the Bay Area Blue Ribbon Transit Recovery Task Force. 🚏 This meeting is an impt opportunity for Bay Area residents to share their support for seamless transit reform. 

Zoom details here: https://t.co/m1gD24Dr58","2021-05-23 23:59 +0000","3119.0","52.0","0.01667201025969862","4.0","0.0","8.0","2.0","20.0","0.0","17.0","0.0","0","0","0","0","0","1","1","-","-","-","-","-","-","-","-","-","-","-","-","-","-","-","-","-","-"
"1396616922125398016","https://twitter.com/seamlessbayarea/status/1396616922125398016","📊 NEW: MTC poll of Bay Area residents conducted in April found *89%* support for a fully integrated, multimodal transit system w/ regional fares &amp; consistent mapping &amp; signage. In short, seamlessness is overwhelmingly popular ⤵️

Full results here: https://t.co/K2w2osqGFZ https://t.co/XiMFYk9X7u","2021-05-23 23:59 +0000","42610.0","566.0","0.013283266838770241","33.0","2.0","98.0","38.0","28.0","0.0","189.0","0.0","0","0","0","0","0","178","178","-","-","-","-","-","-","-","-","-","-","-","-","-","-","-","-","-","-"
"1395882960918695936","https://twitter.com/seamlessbayarea/status/1395882960918695936","Find full meeting details and instructions on how to comment live (or share your thoughts ahead of time) on our blog ⤵️ https://t.co/m1gD24Dr58","2021-05-21 23:23 +0000","666.0","9.0","0.013513513513513514","0.0","0.0","0.0","0.0","9.0","0.0","0.0","0.0","0","0","0","0","0","0","0","-","-","-","-","-","-","-","-","-","-","-","-","-","-","-","-","-","-"
"1395882960067338243","https://twitter.com/seamlessbayarea/status/1395882960067338243","🚨 ACTION ALERT: There are two very important opportunities to give public comment in support of seamless transit this week:

📌 Mon, May 24 at 1pm - Blue Ribbon Transit Recovery Task Force

📌 Weds, May 26 at 3:30pm - Policymaker webinar for the Regional Fare Integration Study","2021-05-21 23:23 +0000","1981.0","27.0","0.013629480060575468","4.0","1.0","5.0","2.0","0.0","0.0","15.0","0.0","0","0","0","0","0","0","0","-","-","-","-","-","-","-","-","-","-","-","-","-","-","-","-","-","-"
"1395799616805736449","https://twitter.com/seamlessbayarea/status/1395799616805736449","We are deeply grateful for Asm. Chiu's leadership on #AB629, and for all of the riders and advocates who organized and spoke out in support of this this bill.

We look forward to continuing to work with lawmakers and advocates to make these critical reforms a reality. Onward!","2021-05-21 17:52 +0000","768.0","11.0","0.014322916666666666","1.0","0.0","3.0","1.0","0.0","1.0","5.0","0.0","0","0","0","0","0","0","0","-","-","-","-","-","-","-","-","-","-","-","-","-","-","-","-","-","-"
"1395799615878832132","https://twitter.com/seamlessbayarea/status/1395799615878832132","With the completion of the Blue Ribbon Transit Recovery Task Force &amp; the Fare Integration Task Force in a few months, a future #AB629 could go much further in creating an equitable, integrated fare structure &amp; setting up a network manager to carry out well-coordinated service.","2021-05-21 17:52 +0000","830.0","7.0","0.008433734939759036","1.0","1.0","4.0","0.0","0.0","0.0","1.0","0.0","0","0","0","0","0","0","0","-","-","-","-","-","-","-","-","-","-","-","-","-","-","-","-","-","-"
"1395799614746419206","https://twitter.com/seamlessbayarea/status/1395799614746419206","Our advocacy is working. More riders and elected leaders than ever are committed to transforming our transit network into a more integrated, accessible, and rider-friendly system. 

And as a two-year bill, we have the opportunity to make #AB629 even better by 2022.","2021-05-21 17:52 +0000","463.0","8.0","0.017278617710583154","1.0","1.0","5.0","0.0","0.0","1.0","0.0","0.0","0","0","0","0","0","0","0","-","-","-","-","-","-","-","-","-","-","-","-","-","-","-","-","-","-"
"1395799613454618628","https://twitter.com/seamlessbayarea/status/1395799613454618628","But even without #AB629 advancing in 2021, real progress is being made on integrated fares and identifying a network management structure for our region.","2021-05-21 17:52 +0000","514.0","15.0","0.029182879377431907","1.0","1.0","5.0","4.0","0.0","0.0","4.0","0.0","0","0","0","0","0","0","0","-","-","-","-","-","-","-","-","-","-","-","-","-","-","-","-","-","-"
"1395799612376502277","https://twitter.com/seamlessbayarea/status/1395799612376502277","We are working to gather more details, and will share more information as soon as we can.","2021-05-21 17:52 +0000","491.0","12.0","0.024439918533604887","1.0","1.0","4.0","4.0","0.0","0.0","2.0","0.0","0","0","0","0","0","0","0","-","-","-","-","-","-","-","-","-","-","-","-","-","-","-","-","-","-"
"1395799611407704068","https://twitter.com/seamlessbayarea/status/1395799611407704068","Yesterday we were disappointed to learn that AB 629, Asm. @DavidChiu’s Seamless and Resilient Bay Area Transit Act, has become a two-year bill and won’t advance until 2022, due to action from the Assembly Appropriations Committee. 🧵","2021-05-21 17:52 +0000","18580.0","318.0","0.017115177610333692","9.0","1.0","41.0","27.0","0.0","0.0","240.0","0.0","0","0","0","0","0","0","0","-","-","-","-","-","-","-","-","-","-","-","-","-","-","-","-","-","-"
"1395787769423691779","https://twitter.com/seamlessbayarea/status/1395787769423691779","Looks Golden Gate Bridge District is likely to approve ""Move Whistle Stop"" design for San Rafael Transit Center - best for seamless transfers and transit riders - as preferred alternative for the EIR, since Transpo Committee unanimously approved yesterday. https://t.co/Pw5Kyr6vkr","2021-05-21 17:05 +0000","720.0","19.0","0.02638888888888889","1.0","0.0","2.0","0.0","8.0","0.0","8.0","0.0","0","0","0","0","0","0","0","-","-","-","-","-","-","-","-","-","-","-","-","-","-","-","-","-","-"
"1395538677770559491","https://twitter.com/seamlessbayarea/status/1395538677770559491","""Ian Griffiths, policy director for Seamless Bay Area, said a long trip from train to street would increase the time it takes to transfer from BART to other transit...It could also make stations challenging for people with limited mobility, he said."" https://t.co/Gml0ClZV49","2021-05-21 00:35 +0000","8727.0","283.0","0.03242809671135556","6.0","2.0","29.0","12.0","107.0","0.0","127.0","0.0","0","0","0","0","0","0","0","-","-","-","-","-","-","-","-","-","-","-","-","-","-","-","-","-","-"
"1395511552984313857","https://twitter.com/seamlessbayarea/status/1395511552984313857","@mmaynez_ Still the best use of one of our shirts that we've ever seen 😂","2021-05-20 22:47 +0000","119.0","6.0","0.05042016806722689","0.0","0.0","2.0","1.0","0.0","0.0","3.0","0.0","0","0","0","0","0","0","0","-","-","-","-","-","-","-","-","-","-","-","-","-","-","-","-","-","-"
"1395459131113308160","https://twitter.com/seamlessbayarea/status/1395459131113308160","TONIGHT: Don't miss the chance to hear from California transportation leaders about the impact of federal funding on the future of transit in our state ⤵️

Seamless supporters can attend for free - DM or email us for info! 🚆🚌🚍🚏 https://t.co/I6KZCB2mra","2021-05-20 19:19 +0000","818.0","4.0","0.004889975550122249","0.0","0.0","1.0","1.0","0.0","0.0","2.0","0.0","0","0","0","0","0","0","0","-","-","-","-","-","-","-","-","-","-","-","-","-","-","-","-","-","-"
"1395063103633510401","https://twitter.com/seamlessbayarea/status/1395063103633510401","📌 Do you live or work in San Mateo County? At tomorrow's meeting of the San Mateo County Democratic Party, Asm. @DavidChiu will be speaking about his vision for a seamlessly integrated transit system. RSVP to attend: https://t.co/Dj42XCZgGS","2021-05-19 17:05 +0000","1805.0","12.0","0.006648199445983379","1.0","0.0","1.0","3.0","1.0","0.0","6.0","0.0","0","0","0","0","0","0","0","-","-","-","-","-","-","-","-","-","-","-","-","-","-","-","-","-","-"
"1394721596800061440","https://twitter.com/seamlessbayarea/status/1394721596800061440","As we emerge from the COVID crisis, what's in store for our state's transportation policy? Join us &amp; @SPUR_Urbanist on May 26 for a conversation with transportation leaders @SenGonzalez33 and @laurafriedman43 about their vision for the future:
https://t.co/f5IEwdFq7Y","2021-05-18 18:28 +0000","2286.0","12.0","0.005249343832020997","1.0","0.0","6.0","0.0","4.0","0.0","1.0","0.0","0","0","0","0","0","0","0","-","-","-","-","-","-","-","-","-","-","-","-","-","-","-","-","-","-"
"1394455829416345601","https://twitter.com/seamlessbayarea/status/1394455829416345601","Nice @StreetsblogSF writeup of our webinar last week 🙌👇 https://t.co/cSaa4Qq0Y9","2021-05-18 00:52 +0000","913.0","2.0","0.002190580503833516","0.0","0.0","1.0","0.0","0.0","0.0","1.0","0.0","0","0","0","0","0","0","0","-","-","-","-","-","-","-","-","-","-","-","-","-","-","-","-","-","-"
"1394423151497338886","https://twitter.com/seamlessbayarea/status/1394423151497338886","ICYMI: Last week we hosted a panel of distinguished experts to discuss the benefits of centralized transit network management in the Bay Area and around the world.

Check out the recorded webinar and find links to relevant research on our blog: https://t.co/2crnaubNum https://t.co/N9Z0q7psXU","2021-05-17 22:42 +0000","1552.0","37.0","0.02384020618556701","1.0","0.0","6.0","2.0","9.0","0.0","1.0","0.0","0","0","0","0","0","18","18","-","-","-","-","-","-","-","-","-","-","-","-","-","-","-","-","-","-"
"1394362866229071875","https://twitter.com/seamlessbayarea/status/1394362866229071875","SWAG ALERT! 

If you make a recurring donation to Seamless during our spring campaign (starting at just $2/month), you'll be eligible for exclusive thank you gifts featuring brand new designs!

👕 T-shirt 🥤 Water bottle 🍺 Coaster set ⭐️ Stickers &amp; more➡️ https://t.co/Li9Xuwxwfc https://t.co/VwDTYx82aI","2021-05-17 18:43 +0000","1787.0","111.0","0.0621152770005596","2.0","0.0","5.0","7.0","13.0","0.0","21.0","0.0","0","0","0","0","0","63","63","-","-","-","-","-","-","-","-","-","-","-","-","-","-","-","-","-","-"
"1393970195828330496","https://twitter.com/seamlessbayarea/status/1393970195828330496","Integrating transit - heavy rail with local buses - can advance equity. 
""If the goal is to help everyone go places, it’s always best to design services that are useful to everyone and make those services connect, rather than run two systems side by side.""
https://t.co/hqYpK9SayF","2021-05-16 16:42 +0000","1287.0","43.0","0.03341103341103341","4.0","1.0","14.0","1.0","14.0","0.0","9.0","0.0","0","0","0","0","0","0","0","-","-","-","-","-","-","-","-","-","-","-","-","-","-","-","-","-","-"
"1392955903201071105","https://twitter.com/seamlessbayarea/status/1392955903201071105","This afternoon, we hosted an outstanding conversation about seamless transit network management with @PaulrsLewis of @EnoTrans, Dr. Michelle DeRobertis, &amp; @icgee of Seamless, moderated by @ratnaamin. 

Catch the replay here: https://t.co/Bm306cUdtG https://t.co/V5U3Ke8pxC","2021-05-13 21:32 +0000","787.0","14.0","0.017789072426937738","0.0","0.0","3.0","3.0","5.0","0.0","1.0","0.0","0","0","0","0","0","2","2","-","-","-","-","-","-","-","-","-","-","-","-","-","-","-","-","-","-"
"1392955020669198336","https://twitter.com/seamlessbayarea/status/1392955020669198336","Missed today's webinar about seamless transit network management? Watch the recording here! https://t.co/Bm306cUdtG https://t.co/Zpb3y0EXwh","2021-05-13 21:28 +0000","738.0","4.0","0.005420054200542005","0.0","0.0","0.0","0.0","2.0","0.0","0.0","0.0","0","0","0","0","0","2","2","-","-","-","-","-","-","-","-","-","-","-","-","-","-","-","-","-","-"
"1392947786333650954","https://twitter.com/seamlessbayarea/status/1392947786333650954","Thank you for your support and advocacy for our vision. We couldn't do this work without you!","2021-05-13 21:00 +0000","710.0","6.0","0.008450704225352112","0.0","0.0","3.0","2.0","0.0","0.0","1.0","0.0","0","0","0","0","0","0","0","-","-","-","-","-","-","-","-","-","-","-","-","-","-","-","-","-","-"
"1392947785356308481","https://twitter.com/seamlessbayarea/status/1392947785356308481","It’s like paying for our bus fare once a month, but with the extra satisfaction of knowing that you’re making transit work better across our region, for everyone!  🚆🚌🚍🚏","2021-05-13 21:00 +0000","720.0","3.0","0.004166666666666667","0.0","1.0","2.0","0.0","0.0","0.0","0.0","0.0","0","0","0","0","0","0","0","-","-","-","-","-","-","-","-","-","-","-","-","-","-","-","-","-","-"
"1392947783762542592","https://twitter.com/seamlessbayarea/status/1392947783762542592","We need your support to maintain this momentum in the months ahead. 

We’ve set a goal of recruiting *50 new recurring donors* this spring. In just two clicks, you can become a recurring donor for $2 per month. https://t.co/Li9Xuwxwfc https://t.co/NtmLtmtK8Z","2021-05-13 21:00 +0000","172.0","5.0","0.029069767441860465","0.0","1.0","2.0","0.0","1.0","0.0","1.0","0.0","0","0","0","0","0","0","0","-","-","-","-","-","-","-","-","-","-","-","-","-","-","-","-","-","-"
"1392947778825846784","https://twitter.com/seamlessbayarea/status/1392947778825846784","Our Seamless Transit Principles now have the support of 1,700 petition supporters and 49 cities, universities, and transit agencies (!) - and more are joining all the time. https://t.co/RiQFjt90cc","2021-05-13 21:00 +0000","192.0","3.0","0.015625","0.0","1.0","2.0","0.0","0.0","0.0","0.0","0.0","0","0","0","0","0","0","0","-","-","-","-","-","-","-","-","-","-","-","-","-","-","-","-","-","-"
