"Tweet id","Tweet permalink","Tweet text","time","impressions","engagements","engagement rate","retweets","replies","likes","user profile clicks","url clicks","hashtag clicks","detail expands","permalink clicks","app opens","app installs","follows","email tweet","dial phone","media views","media engagements","promoted impressions","promoted engagements","promoted engagement rate","promoted retweets","promoted replies","promoted likes","promoted user profile clicks","promoted url clicks","promoted hashtag clicks","promoted detail expands","promoted permalink clicks","promoted app opens","promoted app installs","promoted follows","promoted email tweet","promoted dial phone","promoted media views","promoted media engagements"
"1333553559325925382","https://twitter.com/seamlessbayarea/status/1333553559325925382","Transit agencies across the U.S. are facing a funding crisis. Now is the time to reach out to your state and federal representatives &amp; make sure they know that #TransitisEssential. https://t.co/bFyT9Raglx","2020-11-30 23:28 +0000","1868.0","26.0","0.013918629550321198","3.0","0.0","8.0","3.0","0.0","1.0","11.0","0.0","0","0","0","0","0","0","0","-","-","-","-","-","-","-","-","-","-","-","-","-","-","-","-","-","-"
"1333552396408999936","https://twitter.com/seamlessbayarea/status/1333552396408999936","Even better, thanks to a generous individual donor, all gifts made to Seamless this week will be MATCHED, up to $5,000. Don’t miss this chance to double the impact of your donation! 🚍🚍 

Plus, get exclusive transit swag as our thank you! 👇 https://t.co/wgY1fRekhN","2020-11-30 23:24 +0000","835.0","7.0","0.008383233532934131","1.0","0.0","1.0","1.0","1.0","0.0","1.0","0.0","0","0","0","0","0","2","2","-","-","-","-","-","-","-","-","-","-","-","-","-","-","-","-","-","-"
"1333552391145148416","https://twitter.com/seamlessbayarea/status/1333552391145148416","#GivingTuesday is tomorrow! 

If you support our vision for seamless transit in the Bay Area, we hope you will consider making a contribution. 

Seamless supporters helped make 2020 our most productive year yet. Help us keep the momentum going! https://t.co/MnKA5i4y0w","2020-11-30 23:24 +0000","1052.0","7.0","0.006653992395437262","2.0","1.0","1.0","1.0","1.0","0.0","1.0","0.0","0","0","0","0","0","0","0","-","-","-","-","-","-","-","-","-","-","-","-","-","-","-","-","-","-"
"1333476775213469702","https://twitter.com/seamlessbayarea/status/1333476775213469702","Federal funding will play a critical role in helping our transit system rebuild from the COVID crisis. 

On Dec. 3, join @SFTRU &amp; transit leaders @lateefahsimon, @tilly_chang, @aeaken, @jeffreytumlin, &amp; @ASweetPlanner for a talk about the path to recovery https://t.co/41RvPKlS8h","2020-11-30 18:23 +0000","939.0","5.0","0.005324813631522897","1.0","0.0","3.0","0.0","1.0","0.0","0.0","0.0","0","0","0","0","0","0","0","-","-","-","-","-","-","-","-","-","-","-","-","-","-","-","-","-","-"
"1331386945558114305","https://twitter.com/seamlessbayarea/status/1331386945558114305","As you make plans for #GivingTuesday, keep Seamless Bay Area in mind! 

All donations made between now &amp; Dec. 4 will be MATCHED by a generous supporter, doubling the impact of your gift 🎁🎁

You'll also receive our exclusive transit swag as a thank you! 👕https://t.co/NryaLP8qry","2020-11-24 23:59 +0000","1136.0","11.0","0.009683098591549295","2.0","0.0","1.0","4.0","3.0","0.0","1.0","0.0","0","0","0","0","0","0","0","-","-","-","-","-","-","-","-","-","-","-","-","-","-","-","-","-","-"
"1331046710387171328","https://twitter.com/seamlessbayarea/status/1331046710387171328","Last month, we unveiled our vision for a regional, zone-based system of fares that would improve transit connectivity and accessibility across the region.

Want to help us make integrated fares a reality? Read @alevin's new advocacy guide on our blog: https://t.co/ieNC7do6wc","2020-11-24 01:27 +0000","1245.0","39.0","0.03132530120481928","2.0","0.0","6.0","2.0","24.0","0.0","5.0","0.0","0","0","0","0","0","0","0","-","-","-","-","-","-","-","-","-","-","-","-","-","-","-","-","-","-"
"1330992034811809793","https://twitter.com/seamlessbayarea/status/1330992034811809793","📌 Our friends at @SFTRU are hosting a can't-miss discussion w/ transit leaders @jeffreytumlin, @tilly_chang, @aeaken, @lateefahsimon &amp; @ASweetPlanner on Dec. 3. 

Tune in to hear about the resources our transit network needs to survive the COVID crisis: https://t.co/41RvPKlS8h https://t.co/kTCTEDdZX6","2020-11-23 21:50 +0000","1577.0","88.0","0.05580215599239061","2.0","0.0","9.0","2.0","13.0","0.0","11.0","0.0","0","0","0","0","0","51","51","-","-","-","-","-","-","-","-","-","-","-","-","-","-","-","-","-","-"
"1330614294220656641","https://twitter.com/seamlessbayarea/status/1330614294220656641","Thank you to @RebeccaForBART, @lateefahsimon, and @JaniceForBART, and the entire BART Board for this strong statement in support of seamlessness. 🔥

Read more about the BART Board vote &amp; the Principles on our blog: https://t.co/NUZ1tGKjuW","2020-11-22 20:49 +0000","1728.0","31.0","0.017939814814814815","5.0","0.0","9.0","2.0","6.0","0.0","9.0","0.0","0","0","0","0","0","0","0","-","-","-","-","-","-","-","-","-","-","-","-","-","-","-","-","-","-"
"1330614292752654336","https://twitter.com/seamlessbayarea/status/1330614292752654336","As Director Rebecca Saltzman explained, ""There’s been a lot of work over the past several years to improve connectivity and to make transit more seamless in the Bay Area … and we still have a lot more work to do.” https://t.co/IBbybW73xJ","2020-11-22 20:49 +0000","3720.0","104.0","0.02795698924731183","1.0","1.0","7.0","4.0","0.0","0.0","12.0","0.0","0","0","0","0","0","79","79","-","-","-","-","-","-","-","-","-","-","-","-","-","-","-","-","-","-"
"1330614287493074944","https://twitter.com/seamlessbayarea/status/1330614287493074944","On Thursday, @SFBART became the first Bay Area transit agency to endorse the Seamless Transit Principles 👏👏

The agency joins a growing coalition of municipal, nonprofit &amp; business supporters committed to better transit connectivity in the Bay Area: https://t.co/NUZ1tGKjuW","2020-11-22 20:49 +0000","3040.0","102.0","0.03355263157894737","5.0","1.0","38.0","4.0","18.0","0.0","36.0","0.0","0","0","0","0","0","0","0","-","-","-","-","-","-","-","-","-","-","-","-","-","-","-","-","-","-"
"1329916027707166723","https://twitter.com/seamlessbayarea/status/1329916027707166723","👇👇👇 https://t.co/cORfD0SZcY","2020-11-20 22:34 +0000","973.0","6.0","0.006166495375128468","1.0","0.0","1.0","1.0","0.0","0.0","3.0","0.0","0","0","0","0","0","0","0","-","-","-","-","-","-","-","-","-","-","-","-","-","-","-","-","-","-"
"1329877711376945154","https://twitter.com/seamlessbayarea/status/1329877711376945154","Thanks to a generous Seamless supporter, all donations to Seamless Bay Area's fall fundraising campaign will be MATCHED between now and Dec. 4 🎉

Don't miss this chance to double your impact AND get our exclusive transit swag: https://t.co/NryaLP8qry https://t.co/uSlgtjAHav","2020-11-20 20:02 +0000","2150.0","31.0","0.01441860465116279","4.0","0.0","3.0","2.0","2.0","0.0","9.0","0.0","0","0","0","0","0","11","11","-","-","-","-","-","-","-","-","-","-","-","-","-","-","-","-","-","-"
"1329876150701547521","https://twitter.com/seamlessbayarea/status/1329876150701547521","We're pleased that MTC is changing its original telecommute proposal to provide more flexibility for workers to use transit, walk, and bike to work, in addition to teleworking. Thanks to everyone who took the time to weigh in. https://t.co/olfXInxX4m","2020-11-20 19:55 +0000","838.0","16.0","0.01909307875894988","0.0","0.0","7.0","1.0","8.0","0.0","0.0","0.0","0","0","0","0","0","0","0","-","-","-","-","-","-","-","-","-","-","-","-","-","-","-","-","-","-"
"1329567371472769024","https://twitter.com/seamlessbayarea/status/1329567371472769024","If you want to build on this momentum toward a seamless transit system in 2021, please consider making a donation!

Thanks to a generous supporter, all donations to Seamless Bay Area will be MATCHED if you give between now and Dec. 4: https://t.co/yhTRAyrLhQ","2020-11-19 23:28 +0000","805.0","2.0","0.002484472049689441","0.0","0.0","1.0","0.0","0.0","0.0","1.0","0.0","0","0","0","0","0","0","0","-","-","-","-","-","-","-","-","-","-","-","-","-","-","-","-","-","-"
"1329559533815877634","https://twitter.com/seamlessbayarea/status/1329559533815877634","📢 BIG NEWS 📢

Thanks to the generosity of an individual donor, all donations to Seamless Bay Area between now and Dec. 4 will be MATCHED, up to $5,000! 🎁

Make a contribution today and double your impact! https://t.co/NryaLP8qry https://t.co/CSTrFj7RR6","2020-11-19 22:57 +0000","863.0","11.0","0.012746234067207415","1.0","0.0","4.0","0.0","1.0","0.0","2.0","0.0","0","0","0","0","0","3","3","-","-","-","-","-","-","-","-","-","-","-","-","-","-","-","-","-","-"
"1329545186414788610","https://twitter.com/seamlessbayarea/status/1329545186414788610","Thank you to @RebeccaForBART @lateefahsimon @JaniceForBART &amp; the entire BART Board for unanimously endorsing the Seamless Transit Principles 👏 We look forward to continuing to work with transit leaders across our region to build an integrated, rider-friendly system for all. https://t.co/HbO2lGwbRF","2020-11-19 22:00 +0000","3603.0","39.0","0.010824313072439634","6.0","1.0","18.0","1.0","0.0","0.0","13.0","0.0","0","0","0","0","0","0","0","-","-","-","-","-","-","-","-","-","-","-","-","-","-","-","-","-","-"
"1329203523569864704","https://twitter.com/seamlessbayarea/status/1329203523569864704","A vote by the BART Board to endorse our Seamless Transit Principles would be a major victory for integrated transit in our region. 

Let us know if you'd like to make a comment in support of  transit connectivity at tomorrow's Board meeting! 🗣️ https://t.co/6QCmBIShXO","2020-11-18 23:23 +0000","2866.0","31.0","0.010816468946266573","6.0","1.0","14.0","0.0","0.0","0.0","10.0","0.0","0","0","0","0","0","0","0","-","-","-","-","-","-","-","-","-","-","-","-","-","-","-","-","-","-"
"1328843545990422528","https://twitter.com/seamlessbayarea/status/1328843545990422528","If your organization hasn't signed the Principles yet, it's a great and easy way to show your support for an integrated, rider-friendly Bay Area transit network. 

Learn more here: https://t.co/SzV5FHpksz","2020-11-17 23:32 +0000","757.0","5.0","0.0066050198150594455","0.0","0.0","2.0","0.0","3.0","0.0","0.0","0.0","0","0","0","0","0","0","0","-","-","-","-","-","-","-","-","-","-","-","-","-","-","-","-","-","-"
"1328843064610197504","https://twitter.com/seamlessbayarea/status/1328843064610197504","We're thrilled that the BART Board is discussing the Seamless Transit Principles on Thursday.

Have a personal story about how greater connectivity between BART &amp; other transit providers would improve your life? We encourage you to call in to the meeting: https://t.co/Ltgr7Xfz9e https://t.co/K8kwnpsrLr","2020-11-17 23:30 +0000","7079.0","94.0","0.013278711682441022","8.0","1.0","27.0","4.0","4.0","0.0","50.0","0.0","0","0","0","0","0","0","0","-","-","-","-","-","-","-","-","-","-","-","-","-","-","-","-","-","-"
"1328694506657632258","https://twitter.com/seamlessbayarea/status/1328694506657632258","Finally, thanks to our fellow task force members and partners @SPUR_Urbanist @TransForm_Alert @Urban_Habitat @BayAreaCouncil @SVLeadershipGrp @DavidChiu + others for sustained support and partnership on this shared project of a rider-first, unified Bay Area transit system.🚀","2020-11-17 13:40 +0000","493.0","11.0","0.02231237322515213","0.0","0.0","6.0","1.0","0.0","0.0","4.0","0.0","0","0","0","0","0","0","0","-","-","-","-","-","-","-","-","-","-","-","-","-","-","-","-","-","-"
"1328694505818771456","https://twitter.com/seamlessbayarea/status/1328694505818771456","Thanks to our Transit Agency general managers and staff for your willingness to collaborate on these difficult topics via the task force over the coming months while you deal with the enormous challenges of operating transit during a pandemic. 🙏","2020-11-17 13:40 +0000","470.0","2.0","0.00425531914893617","0.0","1.0","1.0","0.0","0.0","0.0","0.0","0.0","0","0","0","0","0","0","0","-","-","-","-","-","-","-","-","-","-","-","-","-","-","-","-","-","-"
"1328694505009188865","https://twitter.com/seamlessbayarea/status/1328694505009188865","...serving all Bay Area populations, resulting in increased transit ridership and reduced growth in vehicle miles traveled.""  

We are thrilled agencies, elected leaders, &amp; @MTCBATA will be working together on network management + governance reforms to achieve a seamless system!","2020-11-17 13:40 +0000","342.0","4.0","0.011695906432748537","1.0","1.0","1.0","0.0","0.0","0.0","1.0","0.0","0","0","0","0","0","0","0","-","-","-","-","-","-","-","-","-","-","-","-","-","-","-","-","-","-"
"1328694504245878790","https://twitter.com/seamlessbayarea/status/1328694504245878790","The purpose approved is to ""Design, adequately invest in and effectively manage a public transit network that is equitable, inclusive, appropriately frequent, accessible affordable, reliable, &amp; integrated with unified service, fares, schedules, customer information + identity...","2020-11-17 13:40 +0000","189.0","3.0","0.015873015873015872","0.0","1.0","2.0","0.0","0.0","0.0","0.0","0.0","0","0","0","0","0","0","0","-","-","-","-","-","-","-","-","-","-","-","-","-","-","-","-","-","-"
"1328694502387757056","https://twitter.com/seamlessbayarea/status/1328694502387757056","Yesterday's Blue Ribbon Transit Recovery Task Force was a major milestone for seamless transit: approval of the Purpose, Goals + Objectives of the Transformation Action Plan to be developed over the next 9m, with a key goal to identify network management &amp; governance reforms!🥳 https://t.co/Wrjbd3y90D","2020-11-17 13:40 +0000","2360.0","107.0","0.04533898305084746","4.0","3.0","7.0","12.0","2.0","0.0","46.0","0.0","0","0","0","0","0","33","33","-","-","-","-","-","-","-","-","-","-","-","-","-","-","-","-","-","-"
"1328517218376634368","https://twitter.com/seamlessbayarea/status/1328517218376634368","Everybody is talking about integrated fares 👏👏 

We rolled out our Integrated Fare Vision proposal for the Bay Area just a few weeks ago: https://t.co/P94GGBfgVV

Can't wait for this @SPUR_Urbanist panel on Wednesday! https://t.co/sv0LtKEDd1","2020-11-17 01:56 +0000","942.0","5.0","0.005307855626326964","0.0","0.0","2.0","0.0","3.0","0.0","0.0","0.0","0","0","0","0","0","0","0","-","-","-","-","-","-","-","-","-","-","-","-","-","-","-","-","-","-"
"1328462706278498304","https://twitter.com/seamlessbayarea/status/1328462706278498304","This Thursday, 11/19 at 5 p.m., we're co-hosting a conversation with @CaltransHQ Director @ToksOmishakin and @josefow about building a safe, sustainable and multimodal transportation system that serves all Californians.

Join us! https://t.co/cURRyIvmL4","2020-11-16 22:19 +0000","769.0","10.0","0.013003901170351105","0.0","0.0","4.0","0.0","4.0","0.0","2.0","0.0","0","0","0","0","0","0","0","-","-","-","-","-","-","-","-","-","-","-","-","-","-","-","-","-","-"
"1328408382470905856","https://twitter.com/seamlessbayarea/status/1328408382470905856","@npilch Awesome! Thanks Nick! 🎉","2020-11-16 18:43 +0000","31.0","1.0","0.03225806451612903","0.0","0.0","1.0","0.0","0.0","0.0","0.0","0.0","0","0","0","0","0","0","0","-","-","-","-","-","-","-","-","-","-","-","-","-","-","-","-","-","-"
"1328401314133360641","https://twitter.com/seamlessbayarea/status/1328401314133360641","Will you join us?

We've set a goal of recruiting 100 donors as part of our fall fundraising campaign. We're *halfway* there, with only a couple weeks to go! 👏

Donate to Seamless by Dec. 4 and you'll receive our exclusive transit swag as a thank you! https://t.co/NryaLP8qry https://t.co/B98kV8gv8e","2020-11-16 18:15 +0000","836.0","41.0","0.04904306220095694","2.0","0.0","1.0","1.0","5.0","0.0","4.0","0.0","0","0","0","0","0","28","28","-","-","-","-","-","-","-","-","-","-","-","-","-","-","-","-","-","-"
"1328401310987681792","https://twitter.com/seamlessbayarea/status/1328401310987681792","In 2021, we'll continue to organize and advocate for a more rider friendly, integrated, accessible transit system in the Bay Area. https://t.co/c05K1kK5s9","2020-11-16 18:15 +0000","911.0","47.0","0.05159165751920966","0.0","1.0","9.0","0.0","0.0","0.0","2.0","0.0","0","0","0","0","0","35","35","-","-","-","-","-","-","-","-","-","-","-","-","-","-","-","-","-","-"
"1328401308311715840","https://twitter.com/seamlessbayarea/status/1328401308311715840","2020 has been a milestone year for Seamless Bay Area: 

✔️ We're shaping our region's response to COVID as a member of the Transit Recovery Task Force
✔️ We helped pass #MeasureRR to rescue Caltrain
✔️ We're building momentum for integrated fares &amp; other seamless transit reforms","2020-11-16 18:15 +0000","1794.0","34.0","0.0189520624303233","2.0","1.0","8.0","2.0","0.0","0.0","21.0","0.0","0","0","0","0","0","0","0","-","-","-","-","-","-","-","-","-","-","-","-","-","-","-","-","-","-"
"1327681121576833036","https://twitter.com/seamlessbayarea/status/1327681121576833036","Missed our Integrated Fare Vision webinar last week with @icgee, @alevin, and @christofspieler? You can watch the recorded conversation here 🚍🚎🚉  https://t.co/8XE6Sp5CT6 https://t.co/wYBWIHa39m","2020-11-14 18:33 +0000","891.0","34.0","0.038159371492704826","0.0","0.0","2.0","6.0","8.0","0.0","0.0","0.0","0","0","0","0","0","18","18","-","-","-","-","-","-","-","-","-","-","-","-","-","-","-","-","-","-"
"1326909925872775178","https://twitter.com/seamlessbayarea/status/1326909925872775178","Some great ideas and analysis of how to improve transit governance to create a better system from @EnoTrans - especially the case studies on Pittsburgh, Boston, and Minneapolis. Highly relevant to the Bay Area's Blue Ribbon Task Force
https://t.co/ERKwsF25sw","2020-11-12 15:29 +0000","1243.0","13.0","0.010458567980691875","1.0","0.0","3.0","1.0","2.0","0.0","6.0","0.0","0","0","0","0","0","0","0","-","-","-","-","-","-","-","-","-","-","-","-","-","-","-","-","-","-"
"1326680562925404160","https://twitter.com/seamlessbayarea/status/1326680562925404160","Join Friends of Caltrain's @alevin &amp; @CityofSanJose officials on Friday, Nov. 13 at noon to learn about the city's plans to make the Diridon area better for walking, bicycling, and public transit 👉 https://t.co/DzkMc0Nd5z https://t.co/xbFqXsi7K8","2020-11-12 00:17 +0000","1499.0","3.0","0.0020013342228152103","1.0","0.0","2.0","0.0","0.0","0.0","0.0","0.0","0","0","0","0","0","0","0","-","-","-","-","-","-","-","-","-","-","-","-","-","-","-","-","-","-"
"1326280366991106049","https://twitter.com/seamlessbayarea/status/1326280366991106049",".@alevin highlighting the ongoing work of the Fare Coordination &amp; Integration Study, and the Blue Ribbon Transit Recovery Task Force, as once-in-a-generation opportunity to reinvent transit in the Bay Area.","2020-11-10 21:47 +0000","1256.0","6.0","0.004777070063694267","2.0","1.0","2.0","0.0","0.0","0.0","1.0","0.0","0","0","0","0","0","0","0","-","-","-","-","-","-","-","-","-","-","-","-","-","-","-","-","-","-"
"1326280069891854336","https://twitter.com/seamlessbayarea/status/1326280069891854336","Advocacy director @alevin: To implement an integrated fare system, we'll need to have coordination and agreement among Bay Area transit agencies. Is that complicated? Yes, it is.","2020-11-10 21:46 +0000","976.0","12.0","0.012295081967213115","0.0","1.0","2.0","0.0","0.0","0.0","9.0","0.0","0","0","0","0","0","0","0","-","-","-","-","-","-","-","-","-","-","-","-","-","-","-","-","-","-"
"1326279296722235392","https://twitter.com/seamlessbayarea/status/1326279296722235392",".@icgee: Putting this system into place would require reforms to our current system, including establishing a central regional authority that would administer fares and policies","2020-11-10 21:43 +0000","509.0","1.0","0.0019646365422396855","0.0","0.0","0.0","0.0","0.0","0.0","1.0","0.0","0","0","0","0","0","0","0","-","-","-","-","-","-","-","-","-","-","-","-","-","-","-","-","-","-"
"1326275550638301184","https://twitter.com/seamlessbayarea/status/1326275550638301184","""Under our proposal, any trip within 1 or 2 zones is a local fare price, so short trips aren't penalized."" @icgee","2020-11-10 21:28 +0000","703.0","3.0","0.004267425320056899","0.0","0.0","1.0","1.0","0.0","0.0","1.0","0.0","0","0","0","0","0","0","0","-","-","-","-","-","-","-","-","-","-","-","-","-","-","-","-","-","-"
"1326274221228478464","https://twitter.com/seamlessbayarea/status/1326274221228478464","Seamless policy director @icgee: The Bay Area's existing fare system has problems with complexity, equity, and inefficiency - and isn't aligned with broader mobility goals","2020-11-10 21:23 +0000","1320.0","9.0","0.006818181818181818","0.0","3.0","2.0","2.0","0.0","0.0","2.0","0.0","0","0","0","0","0","0","0","-","-","-","-","-","-","-","-","-","-","-","-","-","-","-","-","-","-"
"1326272586573967361","https://twitter.com/seamlessbayarea/status/1326272586573967361","""A good fare system supports equity. It should have structures built in to have different prices for different riders. And it should be easy to understand."" - @christofspieler","2020-11-10 21:16 +0000","629.0","3.0","0.0047694753577106515","0.0","1.0","1.0","0.0","0.0","0.0","1.0","0.0","0","0","0","0","0","0","0","-","-","-","-","-","-","-","-","-","-","-","-","-","-","-","-","-","-"
"1326272151855329280","https://twitter.com/seamlessbayarea/status/1326272151855329280","Urban planning expert @christofspieler today on our fare map webinar: ""A good fare system is mode neutral, and spans multiple agencies. And it doesn't penalize short trips.""","2020-11-10 21:14 +0000","515.0","11.0","0.021359223300970873","0.0","1.0","1.0","0.0","0.0","0.0","9.0","0.0","0","0","0","0","0","0","0","-","-","-","-","-","-","-","-","-","-","-","-","-","-","-","-","-","-"
"1326271277535916032","https://twitter.com/seamlessbayarea/status/1326271277535916032","Happening now - streaming live here: https://t.co/E219a4OFM5 https://t.co/jquYJFwDQf","2020-11-10 21:11 +0000","2906.0","24.0","0.008258774948382657","0.0","2.0","6.0","4.0","2.0","0.0","10.0","0.0","0","0","0","0","0","0","0","-","-","-","-","-","-","-","-","-","-","-","-","-","-","-","-","-","-"
"1326248509406810112","https://twitter.com/seamlessbayarea/status/1326248509406810112","Join us TODAY at 1 p.m. PT for a free webinar about our vision for integrated transit fares in the Bay Area! 

Hear from Seamless Bay Area's @icgee &amp; @alevin, and our special guest @christofspieler - moderated by @Alfleisher 🙌

RSVP here: https://t.co/KvkWAkJ2IP https://t.co/ljDZTuWw7B","2020-11-10 19:40 +0000","1979.0","40.0","0.0202122283981809","3.0","0.0","7.0","8.0","6.0","0.0","4.0","0.0","0","0","0","0","0","12","12","-","-","-","-","-","-","-","-","-","-","-","-","-","-","-","-","-","-"
"1325971378479099905","https://twitter.com/seamlessbayarea/status/1325971378479099905","Happening tomorrow - not too late to sign up! 👇 https://t.co/gpEXbBBV8w","2020-11-10 01:19 +0000","1612.0","14.0","0.008684863523573201","2.0","0.0","6.0","1.0","0.0","0.0","5.0","0.0","0","0","0","0","0","0","0","-","-","-","-","-","-","-","-","-","-","-","-","-","-","-","-","-","-"
"1325522420527104000","https://twitter.com/seamlessbayarea/status/1325522420527104000","📢 One simple fare. Free transfers. Automatic fare caps.📢

Join us on Tuesday, Nov. 10 to learn more about our vision for a unified, zone-based fare system for the Bay Area, with our policy director @icgee &amp; urban planning expert @christofspieler: 

https://t.co/KvkWAkJ2IP https://t.co/gwnryuwV9R","2020-11-08 19:35 +0000","2083.0","167.0","0.0801728276524244","5.0","0.0","33.0","14.0","14.0","0.0","22.0","0.0","0","0","0","0","0","79","79","-","-","-","-","-","-","-","-","-","-","-","-","-","-","-","-","-","-"
"1324799539044179969","https://twitter.com/seamlessbayarea/status/1324799539044179969","In the meantime, read up about our vision for a unified, equitable fare system that would make transit easier to understand, attract more riders, &amp; expand affordable access to housing &amp; jobs 🙌https://t.co/kTJUWELNMc https://t.co/sbKojR0bnH","2020-11-06 19:43 +0000","1108.0","41.0","0.03700361010830325","1.0","0.0","5.0","2.0","12.0","0.0","3.0","0.0","0","0","0","0","0","18","18","-","-","-","-","-","-","-","-","-","-","-","-","-","-","-","-","-","-"
"1324797523484057600","https://twitter.com/seamlessbayarea/status/1324797523484057600","Curious about Seamless Bay Area's new Integrated Fare Vision Map? 

Next Tuesday, hear from our policy director Ian Griffiths &amp; special guest @christofspieler about how a new approach to fares could help make our transit system fairer. 

It's free! https://t.co/FWbOf7s1PL https://t.co/hd6KN6qkqE","2020-11-06 19:35 +0000","2442.0","116.0","0.0475020475020475","9.0","1.0","18.0","9.0","13.0","0.0","30.0","0.0","0","0","0","0","0","36","36","-","-","-","-","-","-","-","-","-","-","-","-","-","-","-","-","-","-"
"1324796054739603457","https://twitter.com/seamlessbayarea/status/1324796054739603457","We're proud to co-host this conversation about the future of transit in California with @SPUR_Urbanist, @SVLeadershipGrp, and the @BayAreaCouncil. 

RSVP here! https://t.co/cURRyIdLTw https://t.co/yXzz94lvLu","2020-11-06 19:29 +0000","1244.0","11.0","0.008842443729903537","1.0","0.0","6.0","0.0","2.0","0.0","2.0","0.0","0","0","0","0","0","0","0","-","-","-","-","-","-","-","-","-","-","-","-","-","-","-","-","-","-"
