"Tweet id","Tweet permalink","Tweet text","time","impressions","engagements","engagement rate","retweets","replies","likes","user profile clicks","url clicks","hashtag clicks","detail expands","permalink clicks","app opens","app installs","follows","email tweet","dial phone","media views","media engagements","promoted impressions","promoted engagements","promoted engagement rate","promoted retweets","promoted replies","promoted likes","promoted user profile clicks","promoted url clicks","promoted hashtag clicks","promoted detail expands","promoted permalink clicks","promoted app opens","promoted app installs","promoted follows","promoted email tweet","promoted dial phone","promoted media views","promoted media engagements"
"1035372873366622215","https://twitter.com/seamlessbayarea/status/1035372873366622215","Mark your calendars! Our next monthly gathering will be a general meeting on Thursday September 13th at 6 PM. We'll check in on ongoing efforts, welcome new members, discuss volunteer needs, and strategize on next steps -- see you there! https://t.co/dhtKcYOeve https://t.co/wlpeAC6jPP","2018-08-31 03:45 +0000","482.0","13.0","0.026970954356846474","0.0","0.0","3.0","1.0","5.0","0.0","4.0","0.0","0","0","0","0","0","0","0","-","-","-","-","-","-","-","-","-","-","-","-","-","-","-","-","-","-"
"1034470261104422912","https://twitter.com/seamlessbayarea/status/1034470261104422912","We strongly support the New Social Compact vision of the future, which includes ""fast and reliable transit, managed regionwide by a single rail and transit authority"". So what are we waiting for? Let's take the first step toward that vision and reform transportation governance. https://t.co/lZ79oPCenb","2018-08-28 15:58 +0000","2593.0","19.0","0.007327419976860779","4.0","0.0","2.0","8.0","0.0","0.0","5.0","0.0","0","0","0","0","0","0","0","-","-","-","-","-","-","-","-","-","-","-","-","-","-","-","-","-","-"
"1033047443846381575","https://twitter.com/seamlessbayarea/status/1033047443846381575","Check out our latest blog post, Let's Raise the Bar on Regionalism! ""A @SPUR_Urbanist forum titled the 'State of Regionalism – Transportation' shows just how far the Bay Area is away from making progress on seamless transportation"" https://t.co/bcfWI7sdBw https://t.co/beoHFaP2eP","2018-08-24 17:44 +0000","719.0","22.0","0.030598052851182198","1.0","0.0","4.0","3.0","10.0","0.0","0.0","0.0","0","0","0","0","0","4","4","-","-","-","-","-","-","-","-","-","-","-","-","-","-","-","-","-","-"
"1029808350039425024","https://twitter.com/seamlessbayarea/status/1029808350039425024","@jeffreytumlin At least those are pixels that can rearranged instead of signs that need to be designed, printed and cut for every update. Potential for improvement!","2018-08-15 19:13 +0000","288.0","7.0","0.024305555555555556","0.0","0.0","3.0","1.0","0.0","0.0","3.0","0.0","0","0","0","0","0","0","0","-","-","-","-","-","-","-","-","-","-","-","-","-","-","-","-","-","-"
"1029807910681903104","https://twitter.com/seamlessbayarea/status/1029807910681903104","@jeffreytumlin We need a bold vision for regional travel in the Bay Area. The status quo set of agencies and ways if working does not deliver meaningful outcomes for the system users. Also no one does UX in transit here. Let's fix that.","2018-08-15 19:11 +0000","323.0","7.0","0.021671826625386997","0.0","1.0","4.0","2.0","0.0","0.0","0.0","0.0","0","0","0","0","0","0","0","-","-","-","-","-","-","-","-","-","-","-","-","-","-","-","-","-","-"
"1029562061955559425","https://twitter.com/seamlessbayarea/status/1029562061955559425","@stevepepple @andybosselman @SFTRU Hear hear! We like you too @stevepepple let's spread the love to @SPUR_Urbanist @alevin @TransForm_Alert fighting the good transit fight","2018-08-15 02:54 +0000","289.0","11.0","0.03806228373702422","0.0","1.0","5.0","0.0","0.0","0.0","5.0","0.0","0","0","0","0","0","0","0","-","-","-","-","-","-","-","-","-","-","-","-","-","-","-","-","-","-"
"1026262538780962816","https://twitter.com/seamlessbayarea/status/1026262538780962816","@catrope #smh that stinks... raises the question of why the bus signage at BART stations is so poor; and yes, with an effective regional transit system, one should expect to easily grasp how the bus connections work at stations","2018-08-06 00:23 +0000","39.0","2.0","0.05128205128205128","0.0","1.0","1.0","0.0","0.0","0.0","0.0","0.0","0","0","0","0","0","0","0","-","-","-","-","-","-","-","-","-","-","-","-","-","-","-","-","-","-"
